{
  "issuer_id": "jwt_issuer_env_123",
  "organization_id": "org_123",
  "project_id": "project_123",
  "environment_id": "env_123",
  "name": "Smoke Auth",
  "issuer": "https://auth.example.test",
  "audience": "palimpsest-smoke",
  "jwks_url": "https://auth.example.test/.well-known/jwks.json",
  "claim_to_field": [
    {
      "claim": "sub",
      "field": "user_id"
    },
    {
      "claim": "org_id",
      "field": "organization_id"
    }
  ],
  "status": "active"
}
